{
  "job_id": "rw34-first-gate",
  "claim_id": "RW-34",
  "attempt": 1,
  "role": "first-gate-review",
  "subject_filing_path": "/tmp/rw34-evidence-run/rw34-json-child-fixture/1/filing.json",
  "status": "success",
  "empirical_pass_claimed": false,
  "verdict": "pass-with-dissent",
  "result": {
    "summary": "First-gate review of the admitted fixture. Same-family review is useful, not independent. No empirical PASS.",
    "findings": [
      {
        "id": "family",
        "severity": "note",
        "claim": "Controller must bind route_family from the admitted profile.",
        "source_path": "docs/research/swarm-briefs/rw34-json-child-fixture.md"
      }
    ]
  },
  "route_family": "cursor-cloud-json-child",
  "route_model": "json-child"
}
